{ "reference": { "referencesCount": 2,
                 "references": [ { "code": "PO-ABC123-2",
                                   "type": "buyer" },
                                 { "code": "PO-XYZ-a",
                                   "type": "consumer" }]},

  "buyer": { "reference": { "code": "buyer-abc",
                            "type": "seller" }},

  "shipTo": { "location": { "mtn": "Jane Doe",
                            "rcp": "ECI Solutions, STG",
                            "alt": "Suite #200",
                            "dal": "4626 N 300 W",
                            "city": "Provo",
                            "region": "UT",
                            "postalCode": "84604" },
              "email": "shipping-contact@example.com",
              "phone": "1-555-555-5555" },

  "itemsCount": 3,
  "items": [{ "reference": { "code": "abc-123",
                             "type": "seller" },
              "quantity": 24,
              "unitCost": 24.99,
              "tracking": "T-123-ABC" },
            { "reference": { "code": "def-456",
                             "type": "seller" },
              "quantity": 2,
              "unitCost": 2.99,
              "tracking": "T-123-ABC" },
            { "reference": { "code": "ghi-789",
                             "type": "seller" },
              "quantity": 1,
              "unitCost": 1.99,
              "tracking": "T-456-DEF" }]}
