{ "reference": { "referencesCount": 2,
                 "references": [{ "code": "PO-ABC123-2",
                                  "type": "buyer" },
                                { "code": "PO-XYZ-a",
                                  "type": "consumer" }]},

  "shippingMethod": { "code": "shipper-123",
                      "name": "usps 2day" },

  "when": "2018-04-24T17:00:00.000Z",
  "whenExpected": "2018-04-26T17:11:30.000Z",
  "tracking": "T-123-ABC",

  "itemsCount": 2,
  "items": [{ "reference": { "code": "abc-123",
                             "type": "seller"},
              "quantity": 24,
              "unitCost": 24.99 },
            { "reference": { "code": "def-456",
                             "type": "seller" },
              "quantity": 2,
              "unitCost": 2.99 },
            { "reference": { "code": "ghi-789",
                             "type": "seller" }}]}
