{ "reference": { "referencesCount": 2,
                 "references": [{ "code": "PO-ABC123-2",
                                  "type": "buyer" },
                                { "code": "PO-XYZ-a",
                                  "type": "consumer" }]},

  "when": "2018-04-24T17:00:00.000Z",
  "whenExpected": "2018-04-26T17:11:30.000Z",
  "tracking": "T-123-ABC" }
