{ "buyer" : { "reference": { "code": "buyer-abc",
                             "type": "seller" }},
  "consumer" : { "reference": { "code": "consumer-xyz",
                                "type": "seller" }},
  "itemsCount": 1,
  "items": [{ "reference": { "code": "abc-123",
                             "type": "seller" }}]}
