{ "reference": { "referencesCount": 2,
                 "references": [ { "code": "PO-ABC123-2",
                                   "type": "buyer" },
                                 { "code": "PO-XYZ-a",
                                   "type": "consumer" }]},

  "buyer": { "reference": { "code": "buyer-abc",
                            "type": "seller" }},

  "shipTo": { "location": { "mtn": "Jane Doe",
                            "rcp": "ECI Solutions, STG",
                            "alt": "Suite #200",
                            "dal": "4626 N 300 W",
                            "city": "Provo",
                            "region": "UT",
                            "postalCode": "84604" },
              "email": "shipping-contact@example.com",
              "phone": "1-555-555-5555" },

  "itemsCount": 3,
  "items": [{ "reference": { "code": "abc-123",
                             "type": "seller" },
              "quantity": 24,
              "unitCost": 24.99,
              "shippingMethod": { "code": "shipper-123",
                                  "name": "usps 2day" },
              "when": "2018-04-24T17:00:00.000Z",
              "whenExpected": "2018-04-26T17:11:30.000Z",
              "tracking": "T-123-ABC" },
            { "reference": { "code": "def-456",
                             "type": "seller" },
              "quantity": 2,
              "unitCost": 2.99,
              "shippingMethod": { "code": "shipper-123",
                                  "name": "usps 2day" },
              "when": "2018-04-24T17:00:00.000Z",
              "whenExpected": "2018-04-26T17:11:30.000Z",
              "tracking": "T-123-ABC" },
            { "reference": { "code": "ghi-789",
                             "type": "seller" },
              "quantity": 1,
              "unitCost": 1.99,
              "shippingMethod": { "code": "shipper-ABC",
                                  "name": "fedx 2day" },
              "when": "2018-04-24T17:00:00.000Z",
              "whenExpected": "2018-04-26T17:11:30.000Z",
              "tracking": "T-456-DEF" }]}
