{ "reference": { "referencesCount": 2,
                 "references": [ { "code": "PO-ABC123-2",
                                   "type": "buyer" },
                                 { "code": "PO-XYZ-a",
                                   "type": "consumer" }]},
  "tracking": "T-456-DEF",
  "itemsCount": 1,
  "items": [
    { "reference": { "code": "ghi-789",
                     "type": "seller" },
      "quantity": 1,
      "unitCost": 1.99 }]}
