{ "reference": { "code": "PO-2159403-2",
                 "type": "buyer" },

  "buyer" : { "reference": { "code": "buyer-abc",
                             "type": "seller" }},

  "consumer" : { "reference": { "code": "consumer-xyz",
                                "type": "seller" },
                 "contract" : { "code": "contract-789",
                                "type": "seller" }},

  "shipTo" : { "location": { "mtn": "Jane Doe",
                             "rcp": "ECi Solutions, STG",
                             "alt": "Suite #200",
                             "dal": "4626 N 300 W",
                             "city": "Provo",
                             "region": "UT",
                             "postalCode": "84604"},
               "email": "shipping-contact@example.com",
               "phone": "1-555-555-5555"},

  "when" : "2018-04-24T17:00:00.000Z",

  "currency": { "code": "DKK",
                "name": "Danish krone",
                "number": 208,
                "precision": 2,
                "scale": 18},

  "itemsCount": 2,
  "items": [{ "reference": { "code": "abc-123",
                             "type": "seller"},
              "quantity": 24,
              "location": { "name": "Main Warehouse",
                            "city": "Dallas",
                            "region": "TX" }}]}
