{ "reference": { "referencesCount": 2,
                 "references": [ { "code": "PO-ABC123-2",
                                   "type": "buyer" }]},
  "package": "1 of 1",
  "itemsCount": 3,
  "items": [{ "reference": { "code": "abc-123",
                             "type": "seller" },
              "quantity": 24,
              "unitCost": 24.99 },
            { "reference": { "code": "def-456",
                             "type": "seller" },
              "quantity": 2,
              "unitCost": 2.99 },
            { "reference": { "code": "ghi-789",
                             "type": "seller" },
              "quantity": 1,
              "unitCost": 1.99 }]}
