{ "reference": { "referencesCount": 2,
                 "references": [ {"code": "PO-2159403-2",
                                  "type": "buyer" },
                                 {"code": "PO-abc-q",
                                  "type": "consumer" }]},

  "buyer": { "reference": { "code": "buyer-abc",
                             "type": "seller" }},

  "consumer": { "reference": { "code": "consumer-xyz",
                                "type": "seller" },
                 "contract": { "code": "contract-789",
                                "type": "seller" }},

  "shipTo": { "location": { "mtn": "Jane Doe",
                             "rcp": "ECI Solutions, STG",
                             "alt": "Suite #200",
                             "dal": "4626 N 300 W",
                             "city": "Provo",
                             "region": "UT",
                             "postalCode": "84604"},
               "email": "shipping-contact@example.com",
               "phone": "1-555-555-5555"},

  "shippingMethod": { "code": "shipper-123",
                       "name": "usps-2day" },

  "when": "2018-04-24T17:00:00.000Z",

  "currency": { "code": "DKK",
                "name": "Danish krone",
                "number": 208,
                "precision": 18,
                "scale": 2},

  "itemsCount": 1,
  "items": [{ "reference": { "code": "abc-123",
                             "type": "seller"},
              "quantity": 24 }]}
